No.     Time           Source                Destination           Protocol Length Info
      1 0.000000       10.0.2.2              69.171.229.16         TCP      78     50839 → 80 [SYN] Seq=0 Win=65535 Len=0 MSS=1460 WS=16 TSval=900594096 TSecr=0 SACK_PERM=1

Frame 1: 78 bytes on wire (624 bits), 78 bytes captured (624 bits)
Ethernet II, Src: Apple_d8:0f:fa (04:0c:ce:d8:0f:fa), Dst: Apple_e5:66:07 (00:26:08:e5:66:07)
Internet Protocol Version 4, Src: 10.0.2.2, Dst: 69.171.229.16
Transmission Control Protocol, Src Port: 50839, Dst Port: 80, Seq: 0, Len: 0
    Source Port: 50839
    Destination Port: 80
    [Stream index: 0]
    [TCP Segment Len: 0]
    Sequence number: 0    (relative sequence number)
    Acknowledgment number: 0
    1011 .... = Header Length: 44 bytes (11)
    Flags: 0x002 (SYN)
    Window size value: 65535
    [Calculated window size: 65535]
    Checksum: 0x9d41 [unverified]
    [Checksum Status: Unverified]
    Urgent pointer: 0
    Options: (24 bytes), Maximum segment size, No-Operation (NOP), Window scale, No-Operation (NOP), No-Operation (NOP), Timestamps, SACK permitted, End of Option List (EOL)

No.     Time           Source                Destination           Protocol Length Info
      2 0.000474       10.0.2.2              69.171.229.16         TCP      78     50840 → 80 [SYN] Seq=0 Win=65535 Len=0 MSS=1460 WS=16 TSval=900594096 TSecr=0 SACK_PERM=1

Frame 2: 78 bytes on wire (624 bits), 78 bytes captured (624 bits)
Ethernet II, Src: Apple_d8:0f:fa (04:0c:ce:d8:0f:fa), Dst: Apple_e5:66:07 (00:26:08:e5:66:07)
Internet Protocol Version 4, Src: 10.0.2.2, Dst: 69.171.229.16
Transmission Control Protocol, Src Port: 50840, Dst Port: 80, Seq: 0, Len: 0
    Source Port: 50840
    Destination Port: 80
    [Stream index: 1]
    [TCP Segment Len: 0]
    Sequence number: 0    (relative sequence number)
    Acknowledgment number: 0
    1011 .... = Header Length: 44 bytes (11)
    Flags: 0x002 (SYN)
    Window size value: 65535
    [Calculated window size: 65535]
    Checksum: 0xe7ec [unverified]
    [Checksum Status: Unverified]
    Urgent pointer: 0
    Options: (24 bytes), Maximum segment size, No-Operation (NOP), Window scale, No-Operation (NOP), No-Operation (NOP), Timestamps, SACK permitted, End of Option List (EOL)

No.     Time           Source                Destination           Protocol Length Info
      3 0.056591       69.171.229.16         10.0.2.2              TCP      74     80 → 50840 [SYN, ACK] Seq=0 Ack=1 Win=14480 Len=0 MSS=1460 SACK_PERM=1 TSval=2197844639 TSecr=900594096 WS=512

Frame 3: 74 bytes on wire (592 bits), 74 bytes captured (592 bits)
Ethernet II, Src: Apple_e5:66:07 (00:26:08:e5:66:07), Dst: Apple_d8:0f:fa (04:0c:ce:d8:0f:fa)
Internet Protocol Version 4, Src: 69.171.229.16, Dst: 10.0.2.2
Transmission Control Protocol, Src Port: 80, Dst Port: 50840, Seq: 0, Ack: 1, Len: 0
    Source Port: 80
    Destination Port: 50840
    [Stream index: 1]
    [TCP Segment Len: 0]
    Sequence number: 0    (relative sequence number)
    Acknowledgment number: 1    (relative ack number)
    1010 .... = Header Length: 40 bytes (10)
    Flags: 0x012 (SYN, ACK)
    Window size value: 14480
    [Calculated window size: 14480]
    Checksum: 0xcc66 [unverified]
    [Checksum Status: Unverified]
    Urgent pointer: 0
    Options: (20 bytes), Maximum segment size, SACK permitted, Timestamps, No-Operation (NOP), Window scale
    [SEQ/ACK analysis]

No.     Time           Source                Destination           Protocol Length Info
      4 0.065590       69.171.229.16         10.0.2.2              TCP      74     80 → 50839 [SYN, ACK] Seq=0 Ack=1 Win=14480 Len=0 MSS=1460 SACK_PERM=1 TSval=2257878540 TSecr=900594096 WS=512

Frame 4: 74 bytes on wire (592 bits), 74 bytes captured (592 bits)
Ethernet II, Src: Apple_e5:66:07 (00:26:08:e5:66:07), Dst: Apple_d8:0f:fa (04:0c:ce:d8:0f:fa)
Internet Protocol Version 4, Src: 69.171.229.16, Dst: 10.0.2.2
Transmission Control Protocol, Src Port: 80, Dst Port: 50839, Seq: 0, Ack: 1, Len: 0
    Source Port: 80
    Destination Port: 50839
    [Stream index: 0]
    [TCP Segment Len: 0]
    Sequence number: 0    (relative sequence number)
    Acknowledgment number: 1    (relative ack number)
    1010 .... = Header Length: 40 bytes (10)
    Flags: 0x012 (SYN, ACK)
    Window size value: 14480
    [Calculated window size: 14480]
    Checksum: 0x256d [unverified]
    [Checksum Status: Unverified]
    Urgent pointer: 0
    Options: (20 bytes), Maximum segment size, SACK permitted, Timestamps, No-Operation (NOP), Window scale
    [SEQ/ACK analysis]

No.     Time           Source                Destination           Protocol Length Info
      5 0.074915       10.0.2.2              69.171.229.16         TCP      66     50840 → 80 [ACK] Seq=1 Ack=1 Win=131760 Len=0 TSval=900594163 TSecr=2197844639

Frame 5: 66 bytes on wire (528 bits), 66 bytes captured (528 bits)
Ethernet II, Src: Apple_d8:0f:fa (04:0c:ce:d8:0f:fa), Dst: Apple_e5:66:07 (00:26:08:e5:66:07)
Internet Protocol Version 4, Src: 10.0.2.2, Dst: 69.171.229.16
Transmission Control Protocol, Src Port: 50840, Dst Port: 80, Seq: 1, Ack: 1, Len: 0
    Source Port: 50840
    Destination Port: 80
    [Stream index: 1]
    [TCP Segment Len: 0]
    Sequence number: 1    (relative sequence number)
    Acknowledgment number: 1    (relative ack number)
    1000 .... = Header Length: 32 bytes (8)
    Flags: 0x010 (ACK)
    Window size value: 8235
    [Calculated window size: 131760]
    [Window size scaling factor: 16]
    Checksum: 0x1357 [unverified]
    [Checksum Status: Unverified]
    Urgent pointer: 0
    Options: (12 bytes), No-Operation (NOP), No-Operation (NOP), Timestamps
    [SEQ/ACK analysis]

No.     Time           Source                Destination           Protocol Length Info
      6 0.075144       10.0.2.2              69.171.229.16         TCP      66     50839 → 80 [ACK] Seq=1 Ack=1 Win=131760 Len=0 TSval=900594163 TSecr=2257878540

Frame 6: 66 bytes on wire (528 bits), 66 bytes captured (528 bits)
Ethernet II, Src: Apple_d8:0f:fa (04:0c:ce:d8:0f:fa), Dst: Apple_e5:66:07 (00:26:08:e5:66:07)
Internet Protocol Version 4, Src: 10.0.2.2, Dst: 69.171.229.16
Transmission Control Protocol, Src Port: 50839, Dst Port: 80, Seq: 1, Ack: 1, Len: 0
    Source Port: 50839
    Destination Port: 80
    [Stream index: 0]
    [TCP Segment Len: 0]
    Sequence number: 1    (relative sequence number)
    Acknowledgment number: 1    (relative ack number)
    1000 .... = Header Length: 32 bytes (8)
    Flags: 0x010 (ACK)
    Window size value: 8235
    [Calculated window size: 131760]
    [Window size scaling factor: 16]
    Checksum: 0x6c5d [unverified]
    [Checksum Status: Unverified]
    Urgent pointer: 0
    Options: (12 bytes), No-Operation (NOP), No-Operation (NOP), Timestamps
    [SEQ/ACK analysis]

No.     Time           Source                Destination           Protocol Length Info
      7 0.075187       10.0.2.2              69.171.229.16         HTTP     1027   GET /plugins/like.php?channel_url=http%3A%2F%2Fstatic.ak.facebook.com%2Fconnect%2Fxd_arbiter.php%3Fversion%3D11%23cb%3Dfefb2eff%26origin%3Dhttp%253A%252F%252Ferratasec.blogspot.com%252Ff2f1258da%26domain%3Derratasec.blogspot.com%26relation%3Dparent.parent&colorscheme=light&extended_social_context=false&href=http%3A%2F%2Ferratasec.blogspot.com%2F2012%2F09%2Fjudge-correctly-rules-wifi-sniffing.html&layout=box_count&locale=en_US&node_type=link&sdk=joey&send=false&show_faces=false&width=55 HTTP/1.1 

Frame 7: 1027 bytes on wire (8216 bits), 1027 bytes captured (8216 bits)
Ethernet II, Src: Apple_d8:0f:fa (04:0c:ce:d8:0f:fa), Dst: Apple_e5:66:07 (00:26:08:e5:66:07)
Internet Protocol Version 4, Src: 10.0.2.2, Dst: 69.171.229.16
Transmission Control Protocol, Src Port: 50840, Dst Port: 80, Seq: 1, Ack: 1, Len: 961
    Source Port: 50840
    Destination Port: 80
    [Stream index: 1]
    [TCP Segment Len: 961]
    Sequence number: 1    (relative sequence number)
    [Next sequence number: 962    (relative sequence number)]
    Acknowledgment number: 1    (relative ack number)
    1000 .... = Header Length: 32 bytes (8)
    Flags: 0x018 (PSH, ACK)
    Window size value: 8235
    [Calculated window size: 131760]
    [Window size scaling factor: 16]
    Checksum: 0xde5a [unverified]
    [Checksum Status: Unverified]
    Urgent pointer: 0
    Options: (12 bytes), No-Operation (NOP), No-Operation (NOP), Timestamps
    [SEQ/ACK analysis]
    TCP payload (961 bytes)
Hypertext Transfer Protocol
     [truncated]GET /plugins/like.php?channel_url=http%3A%2F%2Fstatic.ak.facebook.com%2Fconnect%2Fxd_arbiter.php%3Fversion%3D11%23cb%3Dfefb2eff%26origin%3Dhttp%253A%252F%252Ferratasec.blogspot.com%252Ff2f1258da%26domain%3Derratasec.blogspot.co
        [ [truncated]Expert Info (Chat/Sequence): GET /plugins/like.php?channel_url=http%3A%2F%2Fstatic.ak.facebook.com%2Fconnect%2Fxd_arbiter.php%3Fversion%3D11%23cb%3Dfefb2eff%26origin%3Dhttp%253A%252F%252Ferratasec.blogspot.com%252Ff2f1258da%26d]
        Request Method: GET
        Request URI [truncated]: /plugins/like.php?channel_url=http%3A%2F%2Fstatic.ak.facebook.com%2Fconnect%2Fxd_arbiter.php%3Fversion%3D11%23cb%3Dfefb2eff%26origin%3Dhttp%253A%252F%252Ferratasec.blogspot.com%252Ff2f1258da%26domain%3Derratasec.bl
        Request Version: HTTP/1.1
    Host: www.facebook.com\r\n
    Connection: keep-alive\r\n
    User-Agent: Mozilla/5.0 (Macintosh; Intel Mac OS X 10_8_1) AppleWebKit/537.4 (KHTML, like Gecko) Chrome/22.0.1229.79 Safari/537.4\r\n
    Accept: text/html,application/xhtml+xml,application/xml;q=0.9,*/*;q=0.8\r\n
    Referer: http://erratasec.blogspot.com/2012/09/judge-correctly-rules-wifi-sniffing.html\r\n
    Accept-Encoding: gzip,deflate,sdch\r\n
    Accept-Language: en-US,en;q=0.8\r\n
    Accept-Charset: ISO-8859-1,utf-8;q=0.7,*;q=0.3\r\n
    \r\n
    [Full request URI [truncated]: http://www.facebook.com/plugins/like.php?channel_url=http%3A%2F%2Fstatic.ak.facebook.com%2Fconnect%2Fxd_arbiter.php%3Fversion%3D11%23cb%3Dfefb2eff%26origin%3Dhttp%253A%252F%252Ferratasec.blogspot.com%252Ff2f12]
    [HTTP request 1/5]
    [Response in frame: 14]
    [Next request in frame: 35]

No.     Time           Source                Destination           Protocol Length Info
      8 0.075256       10.0.2.2              69.171.229.16         HTTP     905    GET /plugins/recommendations.php?header=false&site=http%3A%2F%2Ferratasec.blogspot.com&width=275&height=400&app_id=&locale=en_US&sdk=joey&channel=http%3A%2F%2Fstatic.ak.facebook.com%2Fconnect%2Fxd_arbiter.php%3Fversion%3D11%23cb%3Dfce94d15c%26origin%3Dhttp%253A%252F%252Ferratasec.blogspot.com%252Ff2f1258da%26domain%3Derratasec.blogspot.com%26relation%3Dparent.parent HTTP/1.1 

Frame 8: 905 bytes on wire (7240 bits), 905 bytes captured (7240 bits)
Ethernet II, Src: Apple_d8:0f:fa (04:0c:ce:d8:0f:fa), Dst: Apple_e5:66:07 (00:26:08:e5:66:07)
Internet Protocol Version 4, Src: 10.0.2.2, Dst: 69.171.229.16
Transmission Control Protocol, Src Port: 50839, Dst Port: 80, Seq: 1, Ack: 1, Len: 839
    Source Port: 50839
    Destination Port: 80
    [Stream index: 0]
    [TCP Segment Len: 839]
    Sequence number: 1    (relative sequence number)
    [Next sequence number: 840    (relative sequence number)]
    Acknowledgment number: 1    (relative ack number)
    1000 .... = Header Length: 32 bytes (8)
    Flags: 0x018 (PSH, ACK)
    Window size value: 8235
    [Calculated window size: 131760]
    [Window size scaling factor: 16]
    Checksum: 0x2f02 [unverified]
    [Checksum Status: Unverified]
    Urgent pointer: 0
    Options: (12 bytes), No-Operation (NOP), No-Operation (NOP), Timestamps
    [SEQ/ACK analysis]
    TCP payload (839 bytes)
Hypertext Transfer Protocol
     [truncated]GET /plugins/recommendations.php?header=false&site=http%3A%2F%2Ferratasec.blogspot.com&width=275&height=400&app_id=&locale=en_US&sdk=joey&channel=http%3A%2F%2Fstatic.ak.facebook.com%2Fconnect%2Fxd_arbiter.php%3Fversion%3D11%23c
        [ [truncated]Expert Info (Chat/Sequence): GET /plugins/recommendations.php?header=false&site=http%3A%2F%2Ferratasec.blogspot.com&width=275&height=400&app_id=&locale=en_US&sdk=joey&channel=http%3A%2F%2Fstatic.ak.facebook.com%2Fconnect%2Fxd_a]
        Request Method: GET
        Request URI [truncated]: /plugins/recommendations.php?header=false&site=http%3A%2F%2Ferratasec.blogspot.com&width=275&height=400&app_id=&locale=en_US&sdk=joey&channel=http%3A%2F%2Fstatic.ak.facebook.com%2Fconnect%2Fxd_arbiter.php%3Fversion
        Request Version: HTTP/1.1
    Host: www.facebook.com\r\n
    Connection: keep-alive\r\n
    User-Agent: Mozilla/5.0 (Macintosh; Intel Mac OS X 10_8_1) AppleWebKit/537.4 (KHTML, like Gecko) Chrome/22.0.1229.79 Safari/537.4\r\n
    Accept: text/html,application/xhtml+xml,application/xml;q=0.9,*/*;q=0.8\r\n
    Referer: http://erratasec.blogspot.com/2012/09/judge-correctly-rules-wifi-sniffing.html\r\n
    Accept-Encoding: gzip,deflate,sdch\r\n
    Accept-Language: en-US,en;q=0.8\r\n
    Accept-Charset: ISO-8859-1,utf-8;q=0.7,*;q=0.3\r\n
    \r\n
    [Full request URI [truncated]: http://www.facebook.com/plugins/recommendations.php?header=false&site=http%3A%2F%2Ferratasec.blogspot.com&width=275&height=400&app_id=&locale=en_US&sdk=joey&channel=http%3A%2F%2Fstatic.ak.facebook.com%2Fconnec]
    [HTTP request 1/4]
    [Response in frame: 26]
    [Next request in frame: 34]

No.     Time           Source                Destination           Protocol Length Info
      9 0.131491       69.171.229.16         10.0.2.2              TCP      66     80 → 50840 [ACK] Seq=1 Ack=962 Win=16896 Len=0 TSval=2197844714 TSecr=900594164

Frame 9: 66 bytes on wire (528 bits), 66 bytes captured (528 bits)
Ethernet II, Src: Apple_e5:66:07 (00:26:08:e5:66:07), Dst: Apple_d8:0f:fa (04:0c:ce:d8:0f:fa)
Internet Protocol Version 4, Src: 69.171.229.16, Dst: 10.0.2.2
Transmission Control Protocol, Src Port: 80, Dst Port: 50840, Seq: 1, Ack: 962, Len: 0
    Source Port: 80
    Destination Port: 50840
    [Stream index: 1]
    [TCP Segment Len: 0]
    Sequence number: 1    (relative sequence number)
    Acknowledgment number: 962    (relative ack number)
    1000 .... = Header Length: 32 bytes (8)
    Flags: 0x010 (ACK)
    Window size value: 33
    [Calculated window size: 16896]
    [Window size scaling factor: 512]
    Checksum: 0x2f54 [unverified]
    [Checksum Status: Unverified]
    Urgent pointer: 0
    Options: (12 bytes), No-Operation (NOP), No-Operation (NOP), Timestamps
    [SEQ/ACK analysis]

No.     Time           Source                Destination           Protocol Length Info
     10 0.141940       69.171.229.16         10.0.2.2              TCP      66     80 → 50839 [ACK] Seq=1 Ack=840 Win=16384 Len=0 TSval=2257878615 TSecr=900594165

Frame 10: 66 bytes on wire (528 bits), 66 bytes captured (528 bits)
Ethernet II, Src: Apple_e5:66:07 (00:26:08:e5:66:07), Dst: Apple_d8:0f:fa (04:0c:ce:d8:0f:fa)
Internet Protocol Version 4, Src: 69.171.229.16, Dst: 10.0.2.2
Transmission Control Protocol, Src Port: 80, Dst Port: 50839, Seq: 1, Ack: 840, Len: 0
    Source Port: 80
    Destination Port: 50839
    [Stream index: 0]
    [TCP Segment Len: 0]
    Sequence number: 1    (relative sequence number)
    Acknowledgment number: 840    (relative ack number)
    1000 .... = Header Length: 32 bytes (8)
    Flags: 0x010 (ACK)
    Window size value: 32
    [Calculated window size: 16384]
    [Window size scaling factor: 512]
    Checksum: 0x88d4 [unverified]
    [Checksum Status: Unverified]
    Urgent pointer: 0
    Options: (12 bytes), No-Operation (NOP), No-Operation (NOP), Timestamps
    [SEQ/ACK analysis]

No.     Time           Source                Destination           Protocol Length Info
     11 0.176828       69.171.229.16         10.0.2.2              TCP      1514   80 → 50840 [ACK] Seq=1 Ack=962 Win=16896 Len=1448 TSval=2197844759 TSecr=900594164 [TCP segment of a reassembled PDU]

Frame 11: 1514 bytes on wire (12112 bits), 1514 bytes captured (12112 bits)
Ethernet II, Src: Apple_e5:66:07 (00:26:08:e5:66:07), Dst: Apple_d8:0f:fa (04:0c:ce:d8:0f:fa)
Internet Protocol Version 4, Src: 69.171.229.16, Dst: 10.0.2.2
Transmission Control Protocol, Src Port: 80, Dst Port: 50840, Seq: 1, Ack: 962, Len: 1448
    Source Port: 80
    Destination Port: 50840
    [Stream index: 1]
    [TCP Segment Len: 1448]
    Sequence number: 1    (relative sequence number)
    [Next sequence number: 1449    (relative sequence number)]
    Acknowledgment number: 962    (relative ack number)
    1000 .... = Header Length: 32 bytes (8)
    Flags: 0x010 (ACK)
    Window size value: 33
    [Calculated window size: 16896]
    [Window size scaling factor: 512]
    Checksum: 0x0375 [unverified]
    [Checksum Status: Unverified]
    Urgent pointer: 0
    Options: (12 bytes), No-Operation (NOP), No-Operation (NOP), Timestamps
    [SEQ/ACK analysis]
    TCP payload (1448 bytes)
    [Reassembled PDU in frame: 14]
    TCP segment data (1448 bytes)

No.     Time           Source                Destination           Protocol Length Info
     12 0.176929       69.171.229.16         10.0.2.2              TCP      1514   80 → 50840 [ACK] Seq=1449 Ack=962 Win=16896 Len=1448 TSval=2197844759 TSecr=900594164 [TCP segment of a reassembled PDU]

Frame 12: 1514 bytes on wire (12112 bits), 1514 bytes captured (12112 bits)
Ethernet II, Src: Apple_e5:66:07 (00:26:08:e5:66:07), Dst: Apple_d8:0f:fa (04:0c:ce:d8:0f:fa)
Internet Protocol Version 4, Src: 69.171.229.16, Dst: 10.0.2.2
Transmission Control Protocol, Src Port: 80, Dst Port: 50840, Seq: 1449, Ack: 962, Len: 1448
    Source Port: 80
    Destination Port: 50840
    [Stream index: 1]
    [TCP Segment Len: 1448]
    Sequence number: 1449    (relative sequence number)
    [Next sequence number: 2897    (relative sequence number)]
    Acknowledgment number: 962    (relative ack number)
    1000 .... = Header Length: 32 bytes (8)
    Flags: 0x010 (ACK)
    Window size value: 33
    [Calculated window size: 16896]
    [Window size scaling factor: 512]
    Checksum: 0x3b20 [unverified]
    [Checksum Status: Unverified]
    Urgent pointer: 0
    Options: (12 bytes), No-Operation (NOP), No-Operation (NOP), Timestamps
    [SEQ/ACK analysis]
    TCP payload (1448 bytes)
    [Reassembled PDU in frame: 14]
    TCP segment data (1448 bytes)

No.     Time           Source                Destination           Protocol Length Info
     13 0.176967       69.171.229.16         10.0.2.2              TCP      1514   80 → 50840 [ACK] Seq=2897 Ack=962 Win=16896 Len=1448 TSval=2197844759 TSecr=900594164 [TCP segment of a reassembled PDU]

Frame 13: 1514 bytes on wire (12112 bits), 1514 bytes captured (12112 bits)
Ethernet II, Src: Apple_e5:66:07 (00:26:08:e5:66:07), Dst: Apple_d8:0f:fa (04:0c:ce:d8:0f:fa)
Internet Protocol Version 4, Src: 69.171.229.16, Dst: 10.0.2.2
Transmission Control Protocol, Src Port: 80, Dst Port: 50840, Seq: 2897, Ack: 962, Len: 1448
    Source Port: 80
    Destination Port: 50840
    [Stream index: 1]
    [TCP Segment Len: 1448]
    Sequence number: 2897    (relative sequence number)
    [Next sequence number: 4345    (relative sequence number)]
    Acknowledgment number: 962    (relative ack number)
    1000 .... = Header Length: 32 bytes (8)
    Flags: 0x010 (ACK)
    Window size value: 33
    [Calculated window size: 16896]
    [Window size scaling factor: 512]
    Checksum: 0xce6b [unverified]
    [Checksum Status: Unverified]
    Urgent pointer: 0
    Options: (12 bytes), No-Operation (NOP), No-Operation (NOP), Timestamps
    [SEQ/ACK analysis]
    TCP payload (1448 bytes)
    [Reassembled PDU in frame: 14]
    TCP segment data (1448 bytes)

No.     Time           Source                Destination           Protocol Length Info
     14 0.177002       69.171.229.16         10.0.2.2              HTTP     921    HTTP/1.1 200 OK  (text/html)

Frame 14: 921 bytes on wire (7368 bits), 921 bytes captured (7368 bits)
Ethernet II, Src: Apple_e5:66:07 (00:26:08:e5:66:07), Dst: Apple_d8:0f:fa (04:0c:ce:d8:0f:fa)
Internet Protocol Version 4, Src: 69.171.229.16, Dst: 10.0.2.2
Transmission Control Protocol, Src Port: 80, Dst Port: 50840, Seq: 4345, Ack: 962, Len: 855
    Source Port: 80
    Destination Port: 50840
    [Stream index: 1]
    [TCP Segment Len: 855]
    Sequence number: 4345    (relative sequence number)
    [Next sequence number: 5200    (relative sequence number)]
    Acknowledgment number: 962    (relative ack number)
    1000 .... = Header Length: 32 bytes (8)
    Flags: 0x018 (PSH, ACK)
    Window size value: 33
    [Calculated window size: 16896]
    [Window size scaling factor: 512]
    Checksum: 0x5597 [unverified]
    [Checksum Status: Unverified]
    Urgent pointer: 0
    Options: (12 bytes), No-Operation (NOP), No-Operation (NOP), Timestamps
    [SEQ/ACK analysis]
    TCP payload (855 bytes)
    TCP segment data (855 bytes)
[4 Reassembled TCP Segments (5199 bytes): #11(1448), #12(1448), #13(1448), #14(855)]
Hypertext Transfer Protocol
    HTTP/1.1 200 OK\r\n
        [Expert Info (Chat/Sequence): HTTP/1.1 200 OK\r\n]
        Request Version: HTTP/1.1
        Status Code: 200
        [Status Code Description: OK]
        Response Phrase: OK
    Cache-Control: private, no-cache, no-store, must-revalidate\r\n
    Expires: Sat, 01 Jan 2000 00:00:00 GMT\r\n
    Pragma: no-cache\r\n
    X-Content-Type-Options: nosniff\r\n
    X-XSS-Protection: 0\r\n
    Content-Encoding: gzip\r\n
    Content-Type: text/html; charset=utf-8\r\n
    X-FB-Debug: w2MFvWDGg4W48VMyMHQCsSG7UfG0EaXPIqDpKSMegls=\r\n
    Date: Mon, 08 Oct 2012 04:40:49 GMT\r\n
    Transfer-Encoding: chunked\r\n
    Connection: keep-alive\r\n
    \r\n
    [HTTP response 1/5]
    [Time since request: 0.101815000 seconds]
    [Request in frame: 7]
    [Next request in frame: 35]
    [Next response in frame: 55]
    HTTP chunked response
    Content-encoded entity body (gzip): 4778 bytes -> 12615 bytes
    File Data: 12615 bytes
Line-based text data: text/html
    <!DOCTYPE html>\n
    <html lang="en" id="facebook" class="no_js">\n
     [truncated]<head><meta charset="utf-8" /><meta name="robots" content="noodp, noydir" /><meta name="referrer" content="default" id="meta_referrer" /><meta name="description" content=" Facebook is a social utility that connects people with 
    body{background:#fff;font-size:11px;font-family:'lucida grande',tahoma,verdana,arial,sans-serif;color:#333;line-height:1.28;margin:0;padding:0;text-align:left;direction:ltr;unicode-bidi:embed}\n
    h1, h2, h3, h4, h5, h6{font-size:13px;color:#333;margin:0;padding:0}\n
    h1{font-size:14px}\n
    h4, h5, h6{font-size:11px}\n
    p{margin:1em 0}\n
    a{cursor:pointer;color:#3b5998;text-decoration:none}\n
    a:hover{text-decoration:underline}\n
    img{border:0}\n
    td, td.label{font-size:11px;text-align:left}\n
    dd{color:#000}\n
    dt{color:#777}\n
    ul{list-style-type:none;margin:0;padding:0}\n
    abbr{border-bottom:none}\n
    hr{background:#d9d9d9;border-width:0;color:#d9d9d9;height:1px}\n
    .clearfix:after{clear:both;content:".";display:block;font-size:0;height:0;line-height:0;visibility:hidden}\n
    .clearfix{zoom:1}\n
    .datawrap{word-wrap:break-word}\n
    .word_break{display:inline-block}\n
    .ellipsis{overflow:hidden;text-overflow:ellipsis;white-space:nowrap}\n
    .img_loading{position:absolute;top:-9999999px}\n
    .aero{opacity:.5}\n
    .column{float:left}\n
    .center{margin-left:auto;margin-right:auto}\n
    #facebook .hidden_elem{display:none !important}\n
    #facebook .invisible_elem{visibility:hidden}\n
    #facebook .accessible_elem{left:-9999px;position:fixed}\n
    .direction_ltr{direction:ltr}\n
    .direction_rtl{direction:rtl}\n
    .text_align_ltr{text-align:left}\n
    .text_align_rtl{text-align:right}\n
    .uiGrid{border:0;border-collapse:collapse;border-spacing:0}\n
    .uiGridFixed{table-layout:fixed;width:100%}\n
    .uiGrid .vTop{vertical-align:top}\n
    .uiGrid .vMid{vertical-align:middle}\n
    .uiGrid .vBot{vertical-align:bottom}\n
    .uiGrid .hLeft{text-align:left}\n
    .uiGrid .hCent{text-align:center}\n
    .uiGrid .hRght{text-align:right}\n
    .pluginCountBox{background:#fff;border:1px solid #d3d3d3;font-size:13px;height:24px;margin:0;min-width:35px;padding:6px 1px 2px 3px;text-align:center;white-space:nowrap}\n
    .pluginCountBoxIcon{position:relative;top:2px;left:-3px}\n
    .pluginCountBoxNub{position:relative;z-index:2;bottom:1px;height:7px;left:7px;width:0}\n
    .pluginCountBoxNub s, .pluginCountBoxNub i{border-color:#D3D3D3 transparent transparent;border-right:5px solid transparent;border-style:solid;border-width:5px;display:block;position:relative}\n
    .pluginCountBoxNub i{left:0;top:-12px;border-top-color:#fff}\n
    .pluginCountBoxDark{border-color:#c7c7c7;background:#c7c7c7;color:#333}\n
    .pluginCountBoxDarkNub s{border-top-color:#c7c7c7}\n
    .pluginCountBoxDarkNub i{display:none}\n
    .pluginCountTextConnected,\n
    .pluginCountConnected .pluginCountTextDisconnected{display:none}\n
    .pluginCountConnected .pluginCountTextConnected{display:inline}\n
    .sp_like{background-image:url(http://static.ak.fbcdn.net/rsrc.php/v2/yI/x/1dQf_ATK831.png);background-repeat:no-repeat;display:inline-block;height:14px;width:14px}\n
    .sx_like_fav{background-position:-0px -0px}\n
    .sx_like_ch{background-position:-0px -15px}\n
    .sx_like_x{background-position:-0px -30px}\n
    .sx_like_thumb{background-position:-0px -45px}\n
    i.img u{position:absolute;top:-9999999px}\n
    .pluginErrorLink{color:#f03d25}\n
    .fss{font-size:9px}\n
    .fsm{font-size:11px}\n
    .fsl{font-size:13px}\n
    .fsxl{font-size:16px}\n
    .fsxxl{font-size:18px}\n
    .fwn{font-weight:normal}\n
    .fwb{font-weight:bold}\n
    .fcb{color:#333}\n
    .fcg{color:gray}\n
    form{margin:0;padding:0}\n
    label{cursor:pointer;color:#666;font-weight:bold;vertical-align:middle}\n
    label input{font-weight:normal}\n
    textarea, .inputtext, .inputpassword{border:1px solid #bdc7d8;font-family:'lucida grande',tahoma,verdana,arial,sans-serif;font-size:11px;margin:0;padding:3px;-webkit-appearance:none;-webkit-border-radius:0}\n
    textarea{max-width:100%}\n
    select{border:1px solid #bdc7d8;font-family:'lucida grande',tahoma,verdana,arial,sans-serif;font-size:11px;padding:2px}\n
    .inputtext, .inputpassword{padding-bottom:4px}\n
    .inputradio{padding:0;margin:0 5px 0 0;vertical-align:middle}\n
    .inputcheckbox{border:0;vertical-align:middle}\n
    .inputbutton, .inputsubmit{border-style:solid;border-width:1px;border-color:#d9dfea #0e1f5b #0e1f5b #d9dfea;background-color:#3b5998;color:#fff;padding:2px 15px 3px 15px;text-align:center}\n
    .inputsubmit_disabled{background-color:#999;border-bottom:1px solid #000;border-right:1px solid #666;color:#fff}\n
    .inputaux{background:#f0f0f0;border-color:#e7e7e7 #666 #666 #e7e7e7;color:#000}\n
    .inputaux_disabled{color:#999}\n
    .inputsearch{background:#fff url(http://static.ak.fbcdn.net/rsrc.php/v2/y7/x/IJYgcESal33.png) no-repeat left 4px;padding-left:17px}\n
    .pluginButton{background:#eceef5;-webkit-border-radius:3px;border:1px solid #cad4e7;cursor:pointer;padding:2px 6px 4px;white-space:nowrap;color:#3b5998}\n
    .pluginButtonInline{display:inline-block}\n
    .pluginButtonX{cursor:default}\n
    .pluginButton button{background:transparent;border:0;margin:-1px;padding:0;font:inherit;color:inherit;cursor:pointer}\n
    .pluginButtonIcon{position:relative;top:3px;margin-right:3px}\n
    .pluginButtonSmall{padding:0 5px 2px 5px}\n
    .pluginButtonSmall .pluginButtonIcon{margin-right:2px}\n
    .pluginButton:hover{border-color:#9dacce}\n
    .pluginButtonPressed, .pluginButtonPressed:hover{background-color:#eee;border-color:#ddd;color:#aaa}\n
    .pluginSkinDark .pluginButton{background-color:#c7c7c7;border-color:#999;color:#333}\n
    .pluginSkinDark .pluginButton:hover{background-color:#d9d9d9;border-color:#ddd}\n
    .pluginSkinDark .pluginButtonPressed, .pluginSkinDark .pluginButtonPressed:hover{background-color:#444;border-color:#555;color:#666}\n
    .pluginButtonErrorLink{color:#a00;font-weight:bold}\n
    .pluginButtonX .pluginButtonXOff, .pluginButtonX button:hover .pluginButtonXOn{display:inline-block}\n
    .pluginButtonX .pluginButtonXOn, .pluginButtonX button:hover .pluginButtonXOff{display:none}\n
    .pluginButton .pluginButtonThrobber, form.async_saving .pluginButtonIconWithThrobber{display:none}\n
    form.async_saving .pluginButtonThrobber{display:inline-block;margin-top:2px;margin-bottom:1px;max-width:14px}\n
    </style><script>var ServerJSQueue=(function(){var a=[];return {add:function(b){a.push(b);},run:function(){if(!window.require)return;var b=new (window.require('ServerJS'))();for(var c=0;c<a.length;c++)b.handle(a[c]);}};}());\n
     [truncated]document.write=function(){};var onloadRegister_DEPRECATED=function(){},onafterloadRegister_DEPRECATED=function(){},AsyncLoader=(function(){var a=false,b=false,c={loaded:1,complete:1},d=function(){},e=document,f=false;function g
     [truncated]AsyncLoader.load("http:\/\/static.ak.fbcdn.net\/rsrc.php\/v2\/yo\/r\/as2ybcGvfcy.js")</script><script>ServerJSQueue.add({"require":[["lowerDomain"],["Primer"]]});</script></head><body class="plugin webkit mac Locale_en_US"><div
     [truncated]; document.domain='facebook.com';(function(){var a=window.opener||window.parent,b='fb_xdm_frame_'+location.protocol.replace(':','');function c(){try{a.frames[b].proxyMessage(message,[domain]);}catch(e){setTimeout(c,100);}}funct
     [truncated]; })(-1, -1, "u3ex6i71", "fefb2eff", "http:\/\/erratasec.blogspot.com\/f2f1258da", "erratasec.blogspot.com");</script></div></div><script>function envFlush(a){function b(c){for(var d in a)c[d]=a[d];}if(window.requireLazy){requi
    envFlush({"fb_dtsg":"AQBqkmk-","ajaxpipe_token":"AXi4ERfrTshSe6jd","no_cookies":1,"lhsh":"9AQENTLFj","user":"0"});</script><script>\n
    \n
    \n
     [truncated]ServerJSQueue.add({"instances":[["m124953_3",["PluginConnectButton","m124953_2"],[{"plugin":"like","identifier":"http:\/\/erratasec.blogspot.com\/2012\/09\/judge-correctly-rules-wifi-sniffing.html","connected":false,"canpersona
    \n
    </script>

No.     Time           Source                Destination           Protocol Length Info
     15 0.178647       10.0.2.2              69.171.229.16         TCP      66     50840 → 80 [ACK] Seq=962 Ack=2897 Win=129616 Len=0 TSval=900594266 TSecr=2197844759

Frame 15: 66 bytes on wire (528 bits), 66 bytes captured (528 bits)
Ethernet II, Src: Apple_d8:0f:fa (04:0c:ce:d8:0f:fa), Dst: Apple_e5:66:07 (00:26:08:e5:66:07)
Internet Protocol Version 4, Src: 10.0.2.2, Dst: 69.171.229.16
Transmission Control Protocol, Src Port: 50840, Dst Port: 80, Seq: 962, Ack: 2897, Len: 0
    Source Port: 50840
    Destination Port: 80
    [Stream index: 1]
    [TCP Segment Len: 0]
    Sequence number: 962    (relative sequence number)
    Acknowledgment number: 2897    (relative ack number)
    1000 .... = Header Length: 32 bytes (8)
    Flags: 0x010 (ACK)
    Window size value: 8101
    [Calculated window size: 129616]
    [Window size scaling factor: 16]
    Checksum: 0x03ed [unverified]
    [Checksum Status: Unverified]
    Urgent pointer: 0
    Options: (12 bytes), No-Operation (NOP), No-Operation (NOP), Timestamps
    [SEQ/ACK analysis]

No.     Time           Source                Destination           Protocol Length Info
     16 0.179054       10.0.2.2              69.171.229.16         TCP      66     50840 → 80 [ACK] Seq=962 Ack=5200 Win=127312 Len=0 TSval=900594266 TSecr=2197844759

Frame 16: 66 bytes on wire (528 bits), 66 bytes captured (528 bits)
Ethernet II, Src: Apple_d8:0f:fa (04:0c:ce:d8:0f:fa), Dst: Apple_e5:66:07 (00:26:08:e5:66:07)
Internet Protocol Version 4, Src: 10.0.2.2, Dst: 69.171.229.16
Transmission Control Protocol, Src Port: 50840, Dst Port: 80, Seq: 962, Ack: 5200, Len: 0
    Source Port: 50840
    Destination Port: 80
    [Stream index: 1]
    [TCP Segment Len: 0]
    Sequence number: 962    (relative sequence number)
    Acknowledgment number: 5200    (relative ack number)
    1000 .... = Header Length: 32 bytes (8)
    Flags: 0x010 (ACK)
    Window size value: 7957
    [Calculated window size: 127312]
    [Window size scaling factor: 16]
    Checksum: 0xfb7d [unverified]
    [Checksum Status: Unverified]
    Urgent pointer: 0
    Options: (12 bytes), No-Operation (NOP), No-Operation (NOP), Timestamps
    [SEQ/ACK analysis]

No.     Time           Source                Destination           Protocol Length Info
     17 0.197617       69.171.229.16         10.0.2.2              TCP      1514   80 → 50839 [ACK] Seq=1 Ack=840 Win=16384 Len=1448 TSval=2257878672 TSecr=900594165 [TCP segment of a reassembled PDU]

Frame 17: 1514 bytes on wire (12112 bits), 1514 bytes captured (12112 bits)
Ethernet II, Src: Apple_e5:66:07 (00:26:08:e5:66:07), Dst: Apple_d8:0f:fa (04:0c:ce:d8:0f:fa)
Internet Protocol Version 4, Src: 69.171.229.16, Dst: 10.0.2.2
Transmission Control Protocol, Src Port: 80, Dst Port: 50839, Seq: 1, Ack: 840, Len: 1448
    Source Port: 80
    Destination Port: 50839
    [Stream index: 0]
    [TCP Segment Len: 1448]
    Sequence number: 1    (relative sequence number)
    [Next sequence number: 1449    (relative sequence number)]
    Acknowledgment number: 840    (relative ack number)
    1000 .... = Header Length: 32 bytes (8)
    Flags: 0x010 (ACK)
    Window size value: 32
    [Calculated window size: 16384]
    [Window size scaling factor: 512]
    Checksum: 0x5eea [unverified]
    [Checksum Status: Unverified]
    Urgent pointer: 0
    Options: (12 bytes), No-Operation (NOP), No-Operation (NOP), Timestamps
    [SEQ/ACK analysis]
    TCP payload (1448 bytes)
    [Reassembled PDU in frame: 26]
    TCP segment data (1448 bytes)

No.     Time           Source                Destination           Protocol Length Info
     18 0.197739       69.171.229.16         10.0.2.2              TCP      1514   80 → 50839 [ACK] Seq=1449 Ack=840 Win=16384 Len=1448 TSval=2257878672 TSecr=900594165 [TCP segment of a reassembled PDU]

Frame 18: 1514 bytes on wire (12112 bits), 1514 bytes captured (12112 bits)
Ethernet II, Src: Apple_e5:66:07 (00:26:08:e5:66:07), Dst: Apple_d8:0f:fa (04:0c:ce:d8:0f:fa)
Internet Protocol Version 4, Src: 69.171.229.16, Dst: 10.0.2.2
Transmission Control Protocol, Src Port: 80, Dst Port: 50839, Seq: 1449, Ack: 840, Len: 1448
    Source Port: 80
    Destination Port: 50839
    [Stream index: 0]
    [TCP Segment Len: 1448]
    Sequence number: 1449    (relative sequence number)
    [Next sequence number: 2897    (relative sequence number)]
    Acknowledgment number: 840    (relative ack number)
    1000 .... = Header Length: 32 bytes (8)
    Flags: 0x010 (ACK)
    Window size value: 32
    [Calculated window size: 16384]
    [Window size scaling factor: 512]
    Checksum: 0x5efd [unverified]
    [Checksum Status: Unverified]
    Urgent pointer: 0
    Options: (12 bytes), No-Operation (NOP), No-Operation (NOP), Timestamps
    [SEQ/ACK analysis]
    TCP payload (1448 bytes)
    [Reassembled PDU in frame: 26]
    TCP segment data (1448 bytes)

No.     Time           Source                Destination           Protocol Length Info
     19 0.197775       69.171.229.16         10.0.2.2              TCP      71     80 → 50839 [PSH, ACK] Seq=2897 Ack=840 Win=16384 Len=5 TSval=2257878672 TSecr=900594165 [TCP segment of a reassembled PDU]

Frame 19: 71 bytes on wire (568 bits), 71 bytes captured (568 bits)
Ethernet II, Src: Apple_e5:66:07 (00:26:08:e5:66:07), Dst: Apple_d8:0f:fa (04:0c:ce:d8:0f:fa)
Internet Protocol Version 4, Src: 69.171.229.16, Dst: 10.0.2.2
Transmission Control Protocol, Src Port: 80, Dst Port: 50839, Seq: 2897, Ack: 840, Len: 5
    Source Port: 80
    Destination Port: 50839
    [Stream index: 0]
    [TCP Segment Len: 5]
    Sequence number: 2897    (relative sequence number)
    [Next sequence number: 2902    (relative sequence number)]
    Acknowledgment number: 840    (relative ack number)
    1000 .... = Header Length: 32 bytes (8)
    Flags: 0x018 (PSH, ACK)
    Window size value: 32
    [Calculated window size: 16384]
    [Window size scaling factor: 512]
    Checksum: 0xef19 [unverified]
    [Checksum Status: Unverified]
    Urgent pointer: 0
    Options: (12 bytes), No-Operation (NOP), No-Operation (NOP), Timestamps
    [SEQ/ACK analysis]
    TCP payload (5 bytes)
    [Reassembled PDU in frame: 26]
    TCP segment data (5 bytes)

No.     Time           Source                Destination           Protocol Length Info
     20 0.197809       69.171.229.16         10.0.2.2              TCP      1514   80 → 50839 [ACK] Seq=2902 Ack=840 Win=16384 Len=1448 TSval=2257878672 TSecr=900594165 [TCP segment of a reassembled PDU]

Frame 20: 1514 bytes on wire (12112 bits), 1514 bytes captured (12112 bits)
Ethernet II, Src: Apple_e5:66:07 (00:26:08:e5:66:07), Dst: Apple_d8:0f:fa (04:0c:ce:d8:0f:fa)
Internet Protocol Version 4, Src: 69.171.229.16, Dst: 10.0.2.2
Transmission Control Protocol, Src Port: 80, Dst Port: 50839, Seq: 2902, Ack: 840, Len: 1448
    Source Port: 80
    Destination Port: 50839
    [Stream index: 0]
    [TCP Segment Len: 1448]
    Sequence number: 2902    (relative sequence number)
    [Next sequence number: 4350    (relative sequence number)]
    Acknowledgment number: 840    (relative ack number)
    1000 .... = Header Length: 32 bytes (8)
    Flags: 0x010 (ACK)
    Window size value: 32
    [Calculated window size: 16384]
    [Window size scaling factor: 512]
    Checksum: 0x682f [unverified]
    [Checksum Status: Unverified]
    Urgent pointer: 0
    Options: (12 bytes), No-Operation (NOP), No-Operation (NOP), Timestamps
    [SEQ/ACK analysis]
    TCP payload (1448 bytes)
    [Reassembled PDU in frame: 26]
    TCP segment data (1448 bytes)

No.     Time           Source                Destination           Protocol Length Info
     21 0.197990       69.171.229.16         10.0.2.2              TCP      1514   80 → 50839 [PSH, ACK] Seq=4350 Ack=840 Win=16384 Len=1448 TSval=2257878672 TSecr=900594165 [TCP segment of a reassembled PDU]

Frame 21: 1514 bytes on wire (12112 bits), 1514 bytes captured (12112 bits)
Ethernet II, Src: Apple_e5:66:07 (00:26:08:e5:66:07), Dst: Apple_d8:0f:fa (04:0c:ce:d8:0f:fa)
Internet Protocol Version 4, Src: 69.171.229.16, Dst: 10.0.2.2
Transmission Control Protocol, Src Port: 80, Dst Port: 50839, Seq: 4350, Ack: 840, Len: 1448
    Source Port: 80
    Destination Port: 50839
    [Stream index: 0]
    [TCP Segment Len: 1448]
    Sequence number: 4350    (relative sequence number)
    [Next sequence number: 5798    (relative sequence number)]
    Acknowledgment number: 840    (relative ack number)
    1000 .... = Header Length: 32 bytes (8)
    Flags: 0x018 (PSH, ACK)
    Window size value: 32
    [Calculated window size: 16384]
    [Window size scaling factor: 512]
    Checksum: 0x21db [unverified]
    [Checksum Status: Unverified]
    Urgent pointer: 0
    Options: (12 bytes), No-Operation (NOP), No-Operation (NOP), Timestamps
    [SEQ/ACK analysis]
    TCP payload (1448 bytes)
    [Reassembled PDU in frame: 26]
    TCP segment data (1448 bytes)

No.     Time           Source                Destination           Protocol Length Info
     22 0.198028       69.171.229.16         10.0.2.2              TCP      1514   80 → 50839 [ACK] Seq=5798 Ack=840 Win=16384 Len=1448 TSval=2257878672 TSecr=900594165 [TCP segment of a reassembled PDU]

Frame 22: 1514 bytes on wire (12112 bits), 1514 bytes captured (12112 bits)
Ethernet II, Src: Apple_e5:66:07 (00:26:08:e5:66:07), Dst: Apple_d8:0f:fa (04:0c:ce:d8:0f:fa)
Internet Protocol Version 4, Src: 69.171.229.16, Dst: 10.0.2.2
Transmission Control Protocol, Src Port: 80, Dst Port: 50839, Seq: 5798, Ack: 840, Len: 1448
    Source Port: 80
    Destination Port: 50839
    [Stream index: 0]
    [TCP Segment Len: 1448]
    Sequence number: 5798    (relative sequence number)
    [Next sequence number: 7246    (relative sequence number)]
