No.     Time           Source                Destination           Protocol Length Info
      1 0.000000       10.0.2.2              69.171.229.16         TCP      78     50839 → 80 [SYN] Seq=0 Win=65535 Len=0 MSS=1460 WS=16 TSval=900594096 TSecr=0 SACK_PERM=1

Frame 1: 78 bytes on wire (624 bits), 78 bytes captured (624 bits)
Ethernet II, Src: Apple_d8:0f:fa (04:0c:ce:d8:0f:fa), Dst: Apple_e5:66:07 (00:26:08:e5:66:07)
Internet Protocol Version 4, Src: 10.0.2.2, Dst: 69.171.229.16
Transmission Control Protocol, Src Port: 50839, Dst Port: 80, Seq: 0, Len: 0

No.     Time           Source                Destination           Protocol Length Info
      2 0.000474       10.0.2.2              69.171.229.16         TCP      78     50840 → 80 [SYN] Seq=0 Win=65535 Len=0 MSS=1460 WS=16 TSval=900594096 TSecr=0 SACK_PERM=1

Frame 2: 78 bytes on wire (624 bits), 78 bytes captured (624 bits)
Ethernet II, Src: Apple_d8:0f:fa (04:0c:ce:d8:0f:fa), Dst: Apple_e5:66:07 (00:26:08:e5:66:07)
Internet Protocol Version 4, Src: 10.0.2.2, Dst: 69.171.229.16
Transmission Control Protocol, Src Port: 50840, Dst Port: 80, Seq: 0, Len: 0

No.     Time           Source                Destination           Protocol Length Info
      3 0.056591       69.171.229.16         10.0.2.2              TCP      74     80 → 50840 [SYN, ACK] Seq=0 Ack=1 Win=14480 Len=0 MSS=1460 SACK_PERM=1 TSval=2197844639 TSecr=900594096 WS=512

Frame 3: 74 bytes on wire (592 bits), 74 bytes captured (592 bits)
Ethernet II, Src: Apple_e5:66:07 (00:26:08:e5:66:07), Dst: Apple_d8:0f:fa (04:0c:ce:d8:0f:fa)
Internet Protocol Version 4, Src: 69.171.229.16, Dst: 10.0.2.2
Transmission Control Protocol, Src Port: 80, Dst Port: 50840, Seq: 0, Ack: 1, Len: 0

No.     Time           Source                Destination           Protocol Length Info
      4 0.065590       69.171.229.16         10.0.2.2              TCP      74     80 → 50839 [SYN, ACK] Seq=0 Ack=1 Win=14480 Len=0 MSS=1460 SACK_PERM=1 TSval=2257878540 TSecr=900594096 WS=512

Frame 4: 74 bytes on wire (592 bits), 74 bytes captured (592 bits)
Ethernet II, Src: Apple_e5:66:07 (00:26:08:e5:66:07), Dst: Apple_d8:0f:fa (04:0c:ce:d8:0f:fa)
Internet Protocol Version 4, Src: 69.171.229.16, Dst: 10.0.2.2
Transmission Control Protocol, Src Port: 80, Dst Port: 50839, Seq: 0, Ack: 1, Len: 0

No.     Time           Source                Destination           Protocol Length Info
      5 0.074915       10.0.2.2              69.171.229.16         TCP      66     50840 → 80 [ACK] Seq=1 Ack=1 Win=131760 Len=0 TSval=900594163 TSecr=2197844639

Frame 5: 66 bytes on wire (528 bits), 66 bytes captured (528 bits)
Ethernet II, Src: Apple_d8:0f:fa (04:0c:ce:d8:0f:fa), Dst: Apple_e5:66:07 (00:26:08:e5:66:07)
Internet Protocol Version 4, Src: 10.0.2.2, Dst: 69.171.229.16
Transmission Control Protocol, Src Port: 50840, Dst Port: 80, Seq: 1, Ack: 1, Len: 0

No.     Time           Source                Destination           Protocol Length Info
      6 0.075144       10.0.2.2              69.171.229.16         TCP      66     50839 → 80 [ACK] Seq=1 Ack=1 Win=131760 Len=0 TSval=900594163 TSecr=2257878540

Frame 6: 66 bytes on wire (528 bits), 66 bytes captured (528 bits)
Ethernet II, Src: Apple_d8:0f:fa (04:0c:ce:d8:0f:fa), Dst: Apple_e5:66:07 (00:26:08:e5:66:07)
Internet Protocol Version 4, Src: 10.0.2.2, Dst: 69.171.229.16
Transmission Control Protocol, Src Port: 50839, Dst Port: 80, Seq: 1, Ack: 1, Len: 0

No.     Time           Source                Destination           Protocol Length Info
      7 0.075187       10.0.2.2              69.171.229.16         HTTP     1027   GET /plugins/like.php?channel_url=http%3A%2F%2Fstatic.ak.facebook.com%2Fconnect%2Fxd_arbiter.php%3Fversion%3D11%23cb%3Dfefb2eff%26origin%3Dhttp%253A%252F%252Ferratasec.blogspot.com%252Ff2f1258da%26domain%3Derratasec.blogspot.com%26relation%3Dparent.parent&colorscheme=light&extended_social_context=false&href=http%3A%2F%2Ferratasec.blogspot.com%2F2012%2F09%2Fjudge-correctly-rules-wifi-sniffing.html&layout=box_count&locale=en_US&node_type=link&sdk=joey&send=false&show_faces=false&width=55 HTTP/1.1 

Frame 7: 1027 bytes on wire (8216 bits), 1027 bytes captured (8216 bits)
Ethernet II, Src: Apple_d8:0f:fa (04:0c:ce:d8:0f:fa), Dst: Apple_e5:66:07 (00:26:08:e5:66:07)
Internet Protocol Version 4, Src: 10.0.2.2, Dst: 69.171.229.16
Transmission Control Protocol, Src Port: 50840, Dst Port: 80, Seq: 1, Ack: 1, Len: 961
Hypertext Transfer Protocol

No.     Time           Source                Destination           Protocol Length Info
      8 0.075256       10.0.2.2              69.171.229.16         HTTP     905    GET /plugins/recommendations.php?header=false&site=http%3A%2F%2Ferratasec.blogspot.com&width=275&height=400&app_id=&locale=en_US&sdk=joey&channel=http%3A%2F%2Fstatic.ak.facebook.com%2Fconnect%2Fxd_arbiter.php%3Fversion%3D11%23cb%3Dfce94d15c%26origin%3Dhttp%253A%252F%252Ferratasec.blogspot.com%252Ff2f1258da%26domain%3Derratasec.blogspot.com%26relation%3Dparent.parent HTTP/1.1 

Frame 8: 905 bytes on wire (7240 bits), 905 bytes captured (7240 bits)
Ethernet II, Src: Apple_d8:0f:fa (04:0c:ce:d8:0f:fa), Dst: Apple_e5:66:07 (00:26:08:e5:66:07)
Internet Protocol Version 4, Src: 10.0.2.2, Dst: 69.171.229.16
Transmission Control Protocol, Src Port: 50839, Dst Port: 80, Seq: 1, Ack: 1, Len: 839
Hypertext Transfer Protocol

No.     Time           Source                Destination           Protocol Length Info
      9 0.131491       69.171.229.16         10.0.2.2              TCP      66     80 → 50840 [ACK] Seq=1 Ack=962 Win=16896 Len=0 TSval=2197844714 TSecr=900594164

Frame 9: 66 bytes on wire (528 bits), 66 bytes captured (528 bits)
Ethernet II, Src: Apple_e5:66:07 (00:26:08:e5:66:07), Dst: Apple_d8:0f:fa (04:0c:ce:d8:0f:fa)
Internet Protocol Version 4, Src: 69.171.229.16, Dst: 10.0.2.2
Transmission Control Protocol, Src Port: 80, Dst Port: 50840, Seq: 1, Ack: 962, Len: 0

No.     Time           Source                Destination           Protocol Length Info
     10 0.141940       69.171.229.16         10.0.2.2              TCP      66     80 → 50839 [ACK] Seq=1 Ack=840 Win=16384 Len=0 TSval=2257878615 TSecr=900594165

Frame 10: 66 bytes on wire (528 bits), 66 bytes captured (528 bits)
Ethernet II, Src: Apple_e5:66:07 (00:26:08:e5:66:07), Dst: Apple_d8:0f:fa (04:0c:ce:d8:0f:fa)
Internet Protocol Version 4, Src: 69.171.229.16, Dst: 10.0.2.2
Transmission Control Protocol, Src Port: 80, Dst Port: 50839, Seq: 1, Ack: 840, Len: 0

No.     Time           Source                Destination           Protocol Length Info
     11 0.176828       69.171.229.16         10.0.2.2              TCP      1514   80 → 50840 [ACK] Seq=1 Ack=962 Win=16896 Len=1448 TSval=2197844759 TSecr=900594164 [TCP segment of a reassembled PDU]

Frame 11: 1514 bytes on wire (12112 bits), 1514 bytes captured (12112 bits)
Ethernet II, Src: Apple_e5:66:07 (00:26:08:e5:66:07), Dst: Apple_d8:0f:fa (04:0c:ce:d8:0f:fa)
Internet Protocol Version 4, Src: 69.171.229.16, Dst: 10.0.2.2
Transmission Control Protocol, Src Port: 80, Dst Port: 50840, Seq: 1, Ack: 962, Len: 1448

No.     Time           Source                Destination           Protocol Length Info
     12 0.176929       69.171.229.16         10.0.2.2              TCP      1514   80 → 50840 [ACK] Seq=1449 Ack=962 Win=16896 Len=1448 TSval=2197844759 TSecr=900594164 [TCP segment of a reassembled PDU]

Frame 12: 1514 bytes on wire (12112 bits), 1514 bytes captured (12112 bits)
Ethernet II, Src: Apple_e5:66:07 (00:26:08:e5:66:07), Dst: Apple_d8:0f:fa (04:0c:ce:d8:0f:fa)
Internet Protocol Version 4, Src: 69.171.229.16, Dst: 10.0.2.2
Transmission Control Protocol, Src Port: 80, Dst Port: 50840, Seq: 1449, Ack: 962, Len: 1448

No.     Time           Source                Destination           Protocol Length Info
     13 0.176967       69.171.229.16         10.0.2.2              TCP      1514   80 → 50840 [ACK] Seq=2897 Ack=962 Win=16896 Len=1448 TSval=2197844759 TSecr=900594164 [TCP segment of a reassembled PDU]

Frame 13: 1514 bytes on wire (12112 bits), 1514 bytes captured (12112 bits)
Ethernet II, Src: Apple_e5:66:07 (00:26:08:e5:66:07), Dst: Apple_d8:0f:fa (04:0c:ce:d8:0f:fa)
Internet Protocol Version 4, Src: 69.171.229.16, Dst: 10.0.2.2
Transmission Control Protocol, Src Port: 80, Dst Port: 50840, Seq: 2897, Ack: 962, Len: 1448

No.     Time           Source                Destination           Protocol Length Info
     14 0.177002       69.171.229.16         10.0.2.2              HTTP     921    HTTP/1.1 200 OK  (text/html)

Frame 14: 921 bytes on wire (7368 bits), 921 bytes captured (7368 bits)
Ethernet II, Src: Apple_e5:66:07 (00:26:08:e5:66:07), Dst: Apple_d8:0f:fa (04:0c:ce:d8:0f:fa)
Internet Protocol Version 4, Src: 69.171.229.16, Dst: 10.0.2.2
Transmission Control Protocol, Src Port: 80, Dst Port: 50840, Seq: 4345, Ack: 962, Len: 855
[4 Reassembled TCP Segments (5199 bytes): #11(1448), #12(1448), #13(1448), #14(855)]
Hypertext Transfer Protocol
Line-based text data: text/html

No.     Time           Source                Destination           Protocol Length Info
     15 0.178647       10.0.2.2              69.171.229.16         TCP      66     50840 → 80 [ACK] Seq=962 Ack=2897 Win=129616 Len=0 TSval=900594266 TSecr=2197844759

Frame 15: 66 bytes on wire (528 bits), 66 bytes captured (528 bits)
Ethernet II, Src: Apple_d8:0f:fa (04:0c:ce:d8:0f:fa), Dst: Apple_e5:66:07 (00:26:08:e5:66:07)
Internet Protocol Version 4, Src: 10.0.2.2, Dst: 69.171.229.16
Transmission Control Protocol, Src Port: 50840, Dst Port: 80, Seq: 962, Ack: 2897, Len: 0

No.     Time           Source                Destination           Protocol Length Info
     16 0.179054       10.0.2.2              69.171.229.16         TCP      66     50840 → 80 [ACK] Seq=962 Ack=5200 Win=127312 Len=0 TSval=900594266 TSecr=2197844759

Frame 16: 66 bytes on wire (528 bits), 66 bytes captured (528 bits)
Ethernet II, Src: Apple_d8:0f:fa (04:0c:ce:d8:0f:fa), Dst: Apple_e5:66:07 (00:26:08:e5:66:07)
Internet Protocol Version 4, Src: 10.0.2.2, Dst: 69.171.229.16
Transmission Control Protocol, Src Port: 50840, Dst Port: 80, Seq: 962, Ack: 5200, Len: 0

No.     Time           Source                Destination           Protocol Length Info
     17 0.197617       69.171.229.16         10.0.2.2              TCP      1514   80 → 50839 [ACK] Seq=1 Ack=840 Win=16384 Len=1448 TSval=2257878672 TSecr=900594165 [TCP segment of a reassembled PDU]

Frame 17: 1514 bytes on wire (12112 bits), 1514 bytes captured (12112 bits)
Ethernet II, Src: Apple_e5:66:07 (00:26:08:e5:66:07), Dst: Apple_d8:0f:fa (04:0c:ce:d8:0f:fa)
Internet Protocol Version 4, Src: 69.171.229.16, Dst: 10.0.2.2
Transmission Control Protocol, Src Port: 80, Dst Port: 50839, Seq: 1, Ack: 840, Len: 1448

No.     Time           Source                Destination           Protocol Length Info
     18 0.197739       69.171.229.16         10.0.2.2              TCP      1514   80 → 50839 [ACK] Seq=1449 Ack=840 Win=16384 Len=1448 TSval=2257878672 TSecr=900594165 [TCP segment of a reassembled PDU]

Frame 18: 1514 bytes on wire (12112 bits), 1514 bytes captured (12112 bits)
Ethernet II, Src: Apple_e5:66:07 (00:26:08:e5:66:07), Dst: Apple_d8:0f:fa (04:0c:ce:d8:0f:fa)
Internet Protocol Version 4, Src: 69.171.229.16, Dst: 10.0.2.2
Transmission Control Protocol, Src Port: 80, Dst Port: 50839, Seq: 1449, Ack: 840, Len: 1448

No.     Time           Source                Destination           Protocol Length Info
     19 0.197775       69.171.229.16         10.0.2.2              TCP      71     80 → 50839 [PSH, ACK] Seq=2897 Ack=840 Win=16384 Len=5 TSval=2257878672 TSecr=900594165 [TCP segment of a reassembled PDU]

Frame 19: 71 bytes on wire (568 bits), 71 bytes captured (568 bits)
Ethernet II, Src: Apple_e5:66:07 (00:26:08:e5:66:07), Dst: Apple_d8:0f:fa (04:0c:ce:d8:0f:fa)
Internet Protocol Version 4, Src: 69.171.229.16, Dst: 10.0.2.2
Transmission Control Protocol, Src Port: 80, Dst Port: 50839, Seq: 2897, Ack: 840, Len: 5

No.     Time           Source                Destination           Protocol Length Info
     20 0.197809       69.171.229.16         10.0.2.2              TCP      1514   80 → 50839 [ACK] Seq=2902 Ack=840 Win=16384 Len=1448 TSval=2257878672 TSecr=900594165 [TCP segment of a reassembled PDU]

Frame 20: 1514 bytes on wire (12112 bits), 1514 bytes captured (12112 bits)
Ethernet II, Src: Apple_e5:66:07 (00:26:08:e5:66:07), Dst: Apple_d8:0f:fa (04:0c:ce:d8:0f:fa)
Internet Protocol Version 4, Src: 69.171.229.16, Dst: 10.0.2.2
Transmission Control Protocol, Src Port: 80, Dst Port: 50839, Seq: 2902, Ack: 840, Len: 1448

No.     Time           Source                Destination           Protocol Length Info
     21 0.197990       69.171.229.16         10.0.2.2              TCP      1514   80 → 50839 [PSH, ACK] Seq=4350 Ack=840 Win=16384 Len=1448 TSval=2257878672 TSecr=900594165 [TCP segment of a reassembled PDU]

Frame 21: 1514 bytes on wire (12112 bits), 1514 bytes captured (12112 bits)
Ethernet II, Src: Apple_e5:66:07 (00:26:08:e5:66:07), Dst: Apple_d8:0f:fa (04:0c:ce:d8:0f:fa)
Internet Protocol Version 4, Src: 69.171.229.16, Dst: 10.0.2.2
Transmission Control Protocol, Src Port: 80, Dst Port: 50839, Seq: 4350, Ack: 840, Len: 1448

No.     Time           Source                Destination           Protocol Length Info
     22 0.198028       69.171.229.16         10.0.2.2              TCP      1514   80 → 50839 [ACK] Seq=5798 Ack=840 Win=16384 Len=1448 TSval=2257878672 TSecr=900594165 [TCP segment of a reassembled PDU]

Frame 22: 1514 bytes on wire (12112 bits), 1514 bytes captured (12112 bits)
Ethernet II, Src: Apple_e5:66:07 (00:26:08:e5:66:07), Dst: Apple_d8:0f:fa (04:0c:ce:d8:0f:fa)
Internet Protocol Version 4, Src: 69.171.229.16, Dst: 10.0.2.2
Transmission Control Protocol, Src Port: 80, Dst Port: 50839, Seq: 5798, Ack: 840, Len: 1448

No.     Time           Source                Destination           Protocol Length Info
     23 0.198062       69.171.229.16         10.0.2.2              TCP      1514   80 → 50839 [ACK] Seq=7246 Ack=840 Win=16384 Len=1448 TSval=2257878672 TSecr=900594165 [TCP segment of a reassembled PDU]

Frame 23: 1514 bytes on wire (12112 bits), 1514 bytes captured (12112 bits)
Ethernet II, Src: Apple_e5:66:07 (00:26:08:e5:66:07), Dst: Apple_d8:0f:fa (04:0c:ce:d8:0f:fa)
Internet Protocol Version 4, Src: 69.171.229.16, Dst: 10.0.2.2
Transmission Control Protocol, Src Port: 80, Dst Port: 50839, Seq: 7246, Ack: 840, Len: 1448

No.     Time           Source                Destination           Protocol Length Info
     24 0.198096       69.171.229.16         10.0.2.2              TCP      1514   80 → 50839 [ACK] Seq=8694 Ack=840 Win=16384 Len=1448 TSval=2257878672 TSecr=900594165 [TCP segment of a reassembled PDU]

Frame 24: 1514 bytes on wire (12112 bits), 1514 bytes captured (12112 bits)
Ethernet II, Src: Apple_e5:66:07 (00:26:08:e5:66:07), Dst: Apple_d8:0f:fa (04:0c:ce:d8:0f:fa)
Internet Protocol Version 4, Src: 69.171.229.16, Dst: 10.0.2.2
Transmission Control Protocol, Src Port: 80, Dst Port: 50839, Seq: 8694, Ack: 840, Len: 1448

No.     Time           Source                Destination           Protocol Length Info
     25 0.198129       69.171.229.16         10.0.2.2              TCP      1514   80 → 50839 [PSH, ACK] Seq=10142 Ack=840 Win=16384 Len=1448 TSval=2257878672 TSecr=900594165 [TCP segment of a reassembled PDU]

Frame 25: 1514 bytes on wire (12112 bits), 1514 bytes captured (12112 bits)
Ethernet II, Src: Apple_e5:66:07 (00:26:08:e5:66:07), Dst: Apple_d8:0f:fa (04:0c:ce:d8:0f:fa)
Internet Protocol Version 4, Src: 69.171.229.16, Dst: 10.0.2.2
Transmission Control Protocol, Src Port: 80, Dst Port: 50839, Seq: 10142, Ack: 840, Len: 1448

No.     Time           Source                Destination           Protocol Length Info
     26 0.198164       69.171.229.16         10.0.2.2              HTTP     1370   HTTP/1.1 200 OK  (text/html)

Frame 26: 1370 bytes on wire (10960 bits), 1370 bytes captured (10960 bits)
Ethernet II, Src: Apple_e5:66:07 (00:26:08:e5:66:07), Dst: Apple_d8:0f:fa (04:0c:ce:d8:0f:fa)
Internet Protocol Version 4, Src: 69.171.229.16, Dst: 10.0.2.2
Transmission Control Protocol, Src Port: 80, Dst Port: 50839, Seq: 11590, Ack: 840, Len: 1304
[10 Reassembled TCP Segments (12893 bytes): #17(1448), #18(1448), #19(5), #20(1448), #21(1448), #22(1448), #23(1448), #24(1448), #25(1448), #26(1304)]
Hypertext Transfer Protocol
Line-based text data: text/html

No.     Time           Source                Destination           Protocol Length Info
     27 0.201072       10.0.2.2              69.171.229.16         TCP      66     50839 → 80 [ACK] Seq=840 Ack=2897 Win=129616 Len=0 TSval=900594287 TSecr=2257878672

Frame 27: 66 bytes on wire (528 bits), 66 bytes captured (528 bits)
Ethernet II, Src: Apple_d8:0f:fa (04:0c:ce:d8:0f:fa), Dst: Apple_e5:66:07 (00:26:08:e5:66:07)
Internet Protocol Version 4, Src: 10.0.2.2, Dst: 69.171.229.16
Transmission Control Protocol, Src Port: 50839, Dst Port: 80, Seq: 840, Ack: 2897, Len: 0

No.     Time           Source                Destination           Protocol Length Info
     28 0.201387       10.0.2.2              69.171.229.16         TCP      66     50839 → 80 [ACK] Seq=840 Ack=2902 Win=129616 Len=0 TSval=900594287 TSecr=2257878672

Frame 28: 66 bytes on wire (528 bits), 66 bytes captured (528 bits)
Ethernet II, Src: Apple_d8:0f:fa (04:0c:ce:d8:0f:fa), Dst: Apple_e5:66:07 (00:26:08:e5:66:07)
Internet Protocol Version 4, Src: 10.0.2.2, Dst: 69.171.229.16
Transmission Control Protocol, Src Port: 50839, Dst Port: 80, Seq: 840, Ack: 2902, Len: 0

No.     Time           Source                Destination           Protocol Length Info
     29 0.201396       10.0.2.2              69.171.229.16         TCP      66     50839 → 80 [ACK] Seq=840 Ack=5798 Win=128176 Len=0 TSval=900594287 TSecr=2257878672

Frame 29: 66 bytes on wire (528 bits), 66 bytes captured (528 bits)
Ethernet II, Src: Apple_d8:0f:fa (04:0c:ce:d8:0f:fa), Dst: Apple_e5:66:07 (00:26:08:e5:66:07)
Internet Protocol Version 4, Src: 10.0.2.2, Dst: 69.171.229.16
Transmission Control Protocol, Src Port: 50839, Dst Port: 80, Seq: 840, Ack: 5798, Len: 0

No.     Time           Source                Destination           Protocol Length Info
     30 0.201398       10.0.2.2              69.171.229.16         TCP      66     50839 → 80 [ACK] Seq=840 Ack=8694 Win=125280 Len=0 TSval=900594287 TSecr=2257878672

Frame 30: 66 bytes on wire (528 bits), 66 bytes captured (528 bits)
Ethernet II, Src: Apple_d8:0f:fa (04:0c:ce:d8:0f:fa), Dst: Apple_e5:66:07 (00:26:08:e5:66:07)
Internet Protocol Version 4, Src: 10.0.2.2, Dst: 69.171.229.16
Transmission Control Protocol, Src Port: 50839, Dst Port: 80, Seq: 840, Ack: 8694, Len: 0

No.     Time           Source                Destination           Protocol Length Info
     31 0.201401       10.0.2.2              69.171.229.16         TCP      66     50839 → 80 [ACK] Seq=840 Ack=10142 Win=131072 Len=0 TSval=900594288 TSecr=2257878672

Frame 31: 66 bytes on wire (528 bits), 66 bytes captured (528 bits)
Ethernet II, Src: Apple_d8:0f:fa (04:0c:ce:d8:0f:fa), Dst: Apple_e5:66:07 (00:26:08:e5:66:07)
Internet Protocol Version 4, Src: 10.0.2.2, Dst: 69.171.229.16
Transmission Control Protocol, Src Port: 50839, Dst Port: 80, Seq: 840, Ack: 10142, Len: 0

No.     Time           Source                Destination           Protocol Length Info
     32 0.201451       10.0.2.2              69.171.229.16         TCP      66     50839 → 80 [ACK] Seq=840 Ack=11590 Win=129616 Len=0 TSval=900594288 TSecr=2257878672

Frame 32: 66 bytes on wire (528 bits), 66 bytes captured (528 bits)
Ethernet II, Src: Apple_d8:0f:fa (04:0c:ce:d8:0f:fa), Dst: Apple_e5:66:07 (00:26:08:e5:66:07)
Internet Protocol Version 4, Src: 10.0.2.2, Dst: 69.171.229.16
Transmission Control Protocol, Src Port: 50839, Dst Port: 80, Seq: 840, Ack: 11590, Len: 0

No.     Time           Source                Destination           Protocol Length Info
     33 0.201453       10.0.2.2              69.171.229.16         TCP      66     50839 → 80 [ACK] Seq=840 Ack=12894 Win=128320 Len=0 TSval=900594288 TSecr=2257878672

Frame 33: 66 bytes on wire (528 bits), 66 bytes captured (528 bits)
Ethernet II, Src: Apple_d8:0f:fa (04:0c:ce:d8:0f:fa), Dst: Apple_e5:66:07 (00:26:08:e5:66:07)
Internet Protocol Version 4, Src: 10.0.2.2, Dst: 69.171.229.16
Transmission Control Protocol, Src Port: 50839, Dst Port: 80, Seq: 840, Ack: 12894, Len: 0

No.     Time           Source                Destination           Protocol Length Info
     34 0.562343       10.0.2.2              69.171.229.16         HTTP     1029   GET /plugins/like.php?channel_url=http%3A%2F%2Fstatic.ak.facebook.com%2Fconnect%2Fxd_arbiter.php%3Fversion%3D11%23cb%3Df1f49fa46c%26origin%3Dhttp%253A%252F%252Ferratasec.blogspot.com%252Ff2f1258da%26domain%3Derratasec.blogspot.com%26relation%3Dparent.parent&colorscheme=light&extended_social_context=false&href=http%3A%2F%2Ferratasec.blogspot.com%2F2012%2F09%2Fjudge-correctly-rules-wifi-sniffing.html&layout=box_count&locale=en_US&node_type=link&sdk=joey&send=false&show_faces=false&width=55 HTTP/1.1 

Frame 34: 1029 bytes on wire (8232 bits), 1029 bytes captured (8232 bits)
Ethernet II, Src: Apple_d8:0f:fa (04:0c:ce:d8:0f:fa), Dst: Apple_e5:66:07 (00:26:08:e5:66:07)
Internet Protocol Version 4, Src: 10.0.2.2, Dst: 69.171.229.16
Transmission Control Protocol, Src Port: 50839, Dst Port: 80, Seq: 840, Ack: 12894, Len: 963
Hypertext Transfer Protocol

No.     Time           Source                Destination           Protocol Length Info
     35 0.562929       10.0.2.2              69.171.229.16         HTTP     905    GET /plugins/recommendations.php?header=false&site=http%3A%2F%2Ferratasec.blogspot.com&width=275&height=400&app_id=&locale=en_US&sdk=joey&channel=http%3A%2F%2Fstatic.ak.facebook.com%2Fconnect%2Fxd_arbiter.php%3Fversion%3D11%23cb%3Df1326e81c%26origin%3Dhttp%253A%252F%252Ferratasec.blogspot.com%252Ff2f1258da%26domain%3Derratasec.blogspot.com%26relation%3Dparent.parent HTTP/1.1 

Frame 35: 905 bytes on wire (7240 bits), 905 bytes captured (7240 bits)
Ethernet II, Src: Apple_d8:0f:fa (04:0c:ce:d8:0f:fa), Dst: Apple_e5:66:07 (00:26:08:e5:66:07)
Internet Protocol Version 4, Src: 10.0.2.2, Dst: 69.171.229.16
Transmission Control Protocol, Src Port: 50840, Dst Port: 80, Seq: 962, Ack: 5200, Len: 839
Hypertext Transfer Protocol

No.     Time           Source                Destination           Protocol Length Info
     36 0.618319       69.171.229.16         10.0.2.2              TCP      66     80 → 50840 [ACK] Seq=5200 Ack=1801 Win=18432 Len=0 TSval=2197845201 TSecr=900594631

Frame 36: 66 bytes on wire (528 bits), 66 bytes captured (528 bits)
Ethernet II, Src: Apple_e5:66:07 (00:26:08:e5:66:07), Dst: Apple_d8:0f:fa (04:0c:ce:d8:0f:fa)
Internet Protocol Version 4, Src: 69.171.229.16, Dst: 10.0.2.2
Transmission Control Protocol, Src Port: 80, Dst Port: 50840, Seq: 5200, Ack: 1801, Len: 0

No.     Time           Source                Destination           Protocol Length Info
     37 0.627731       69.171.229.16         10.0.2.2              TCP      66     80 → 50839 [ACK] Seq=12894 Ack=1803 Win=18432 Len=0 TSval=2257879102 TSecr=900594631

Frame 37: 66 bytes on wire (528 bits), 66 bytes captured (528 bits)
Ethernet II, Src: Apple_e5:66:07 (00:26:08:e5:66:07), Dst: Apple_d8:0f:fa (04:0c:ce:d8:0f:fa)
Internet Protocol Version 4, Src: 69.171.229.16, Dst: 10.0.2.2
Transmission Control Protocol, Src Port: 80, Dst Port: 50839, Seq: 12894, Ack: 1803, Len: 0

No.     Time           Source                Destination           Protocol Length Info
     38 0.672696       69.171.229.16         10.0.2.2              TCP      1514   80 → 50839 [ACK] Seq=12894 Ack=1803 Win=18432 Len=1448 TSval=2257879147 TSecr=900594631 [TCP segment of a reassembled PDU]

Frame 38: 1514 bytes on wire (12112 bits), 1514 bytes captured (12112 bits)
Ethernet II, Src: Apple_e5:66:07 (00:26:08:e5:66:07), Dst: Apple_d8:0f:fa (04:0c:ce:d8:0f:fa)
Internet Protocol Version 4, Src: 69.171.229.16, Dst: 10.0.2.2
Transmission Control Protocol, Src Port: 80, Dst Port: 50839, Seq: 12894, Ack: 1803, Len: 1448

No.     Time           Source                Destination           Protocol Length Info
     39 0.672825       69.171.229.16         10.0.2.2              TCP      71     80 → 50839 [PSH, ACK] Seq=14342 Ack=1803 Win=18432 Len=5 TSval=2257879147 TSecr=900594631 [TCP segment of a reassembled PDU]

Frame 39: 71 bytes on wire (568 bits), 71 bytes captured (568 bits)
Ethernet II, Src: Apple_e5:66:07 (00:26:08:e5:66:07), Dst: Apple_d8:0f:fa (04:0c:ce:d8:0f:fa)
Internet Protocol Version 4, Src: 69.171.229.16, Dst: 10.0.2.2
Transmission Control Protocol, Src Port: 80, Dst Port: 50839, Seq: 14342, Ack: 1803, Len: 5

No.     Time           Source                Destination           Protocol Length Info
     40 0.672862       69.171.229.16         10.0.2.2              TCP      1514   80 → 50839 [ACK] Seq=14347 Ack=1803 Win=18432 Len=1448 TSval=2257879147 TSecr=900594631 [TCP segment of a reassembled PDU]

Frame 40: 1514 bytes on wire (12112 bits), 1514 bytes captured (12112 bits)
Ethernet II, Src: Apple_e5:66:07 (00:26:08:e5:66:07), Dst: Apple_d8:0f:fa (04:0c:ce:d8:0f:fa)
Internet Protocol Version 4, Src: 69.171.229.16, Dst: 10.0.2.2
Transmission Control Protocol, Src Port: 80, Dst Port: 50839, Seq: 14347, Ack: 1803, Len: 1448

No.     Time           Source                Destination           Protocol Length Info
     41 0.672897       69.171.229.16         10.0.2.2              TCP      1514   80 → 50839 [ACK] Seq=15795 Ack=1803 Win=18432 Len=1448 TSval=2257879147 TSecr=900594631 [TCP segment of a reassembled PDU]

Frame 41: 1514 bytes on wire (12112 bits), 1514 bytes captured (12112 bits)
Ethernet II, Src: Apple_e5:66:07 (00:26:08:e5:66:07), Dst: Apple_d8:0f:fa (04:0c:ce:d8:0f:fa)
Internet Protocol Version 4, Src: 69.171.229.16, Dst: 10.0.2.2
Transmission Control Protocol, Src Port: 80, Dst Port: 50839, Seq: 15795, Ack: 1803, Len: 1448

No.     Time           Source                Destination           Protocol Length Info
     42 0.672932       69.171.229.16         10.0.2.2              HTTP     915    HTTP/1.1 200 OK  (text/html)

Frame 42: 915 bytes on wire (7320 bits), 915 bytes captured (7320 bits)
Ethernet II, Src: Apple_e5:66:07 (00:26:08:e5:66:07), Dst: Apple_d8:0f:fa (04:0c:ce:d8:0f:fa)
Internet Protocol Version 4, Src: 69.171.229.16, Dst: 10.0.2.2
Transmission Control Protocol, Src Port: 80, Dst Port: 50839, Seq: 17243, Ack: 1803, Len: 849
[5 Reassembled TCP Segments (5198 bytes): #38(1448), #39(5), #40(1448), #41(1448), #42(849)]
Hypertext Transfer Protocol
Line-based text data: text/html

No.     Time           Source                Destination           Protocol Length Info
     43 0.674611       10.0.2.2              69.171.229.16         TCP      66     50839 → 80 [ACK] Seq=1803 Ack=14347 Win=131056 Len=0 TSval=900594739 TSecr=2257879147

Frame 43: 66 bytes on wire (528 bits), 66 bytes captured (528 bits)
Ethernet II, Src: Apple_d8:0f:fa (04:0c:ce:d8:0f:fa), Dst: Apple_e5:66:07 (00:26:08:e5:66:07)
Internet Protocol Version 4, Src: 10.0.2.2, Dst: 69.171.229.16
Transmission Control Protocol, Src Port: 50839, Dst Port: 80, Seq: 1803, Ack: 14347, Len: 0

No.     Time           Source                Destination           Protocol Length Info
     44 0.675015       10.0.2.2              69.171.229.16         TCP      66     50839 → 80 [ACK] Seq=1803 Ack=17243 Win=128160 Len=0 TSval=900594739 TSecr=2257879147

Frame 44: 66 bytes on wire (528 bits), 66 bytes captured (528 bits)
Ethernet II, Src: Apple_d8:0f:fa (04:0c:ce:d8:0f:fa), Dst: Apple_e5:66:07 (00:26:08:e5:66:07)
Internet Protocol Version 4, Src: 10.0.2.2, Dst: 69.171.229.16
Transmission Control Protocol, Src Port: 50839, Dst Port: 80, Seq: 1803, Ack: 17243, Len: 0

No.     Time           Source                Destination           Protocol Length Info
     45 0.675024       10.0.2.2              69.171.229.16         TCP      66     50839 → 80 [ACK] Seq=1803 Ack=18092 Win=127312 Len=0 TSval=900594739 TSecr=2257879147

Frame 45: 66 bytes on wire (528 bits), 66 bytes captured (528 bits)
Ethernet II, Src: Apple_d8:0f:fa (04:0c:ce:d8:0f:fa), Dst: Apple_e5:66:07 (00:26:08:e5:66:07)
Internet Protocol Version 4, Src: 10.0.2.2, Dst: 69.171.229.16
Transmission Control Protocol, Src Port: 50839, Dst Port: 80, Seq: 1803, Ack: 18092, Len: 0

No.     Time           Source                Destination           Protocol Length Info
     46 0.683288       69.171.229.16         10.0.2.2              TCP      1514   80 → 50840 [ACK] Seq=5200 Ack=1801 Win=18432 Len=1448 TSval=2197845266 TSecr=900594631 [TCP segment of a reassembled PDU]

Frame 46: 1514 bytes on wire (12112 bits), 1514 bytes captured (12112 bits)
Ethernet II, Src: Apple_e5:66:07 (00:26:08:e5:66:07), Dst: Apple_d8:0f:fa (04:0c:ce:d8:0f:fa)
Internet Protocol Version 4, Src: 69.171.229.16, Dst: 10.0.2.2
Transmission Control Protocol, Src Port: 80, Dst Port: 50840, Seq: 5200, Ack: 1801, Len: 1448

No.     Time           Source                Destination           Protocol Length Info
     47 0.683433       69.171.229.16         10.0.2.2              TCP      1514   80 → 50840 [ACK] Seq=6648 Ack=1801 Win=18432 Len=1448 TSval=2197845266 TSecr=900594631 [TCP segment of a reassembled PDU]

Frame 47: 1514 bytes on wire (12112 bits), 1514 bytes captured (12112 bits)
Ethernet II, Src: Apple_e5:66:07 (00:26:08:e5:66:07), Dst: Apple_d8:0f:fa (04:0c:ce:d8:0f:fa)
Internet Protocol Version 4, Src: 69.171.229.16, Dst: 10.0.2.2
Transmission Control Protocol, Src Port: 80, Dst Port: 50840, Seq: 6648, Ack: 1801, Len: 1448

No.     Time           Source                Destination           Protocol Length Info
     48 0.683491       69.171.229.16         10.0.2.2              TCP      71     80 → 50840 [PSH, ACK] Seq=8096 Ack=1801 Win=18432 Len=5 TSval=2197845266 TSecr=900594631 [TCP segment of a reassembled PDU]

Frame 48: 71 bytes on wire (568 bits), 71 bytes captured (568 bits)
Ethernet II, Src: Apple_e5:66:07 (00:26:08:e5:66:07), Dst: Apple_d8:0f:fa (04:0c:ce:d8:0f:fa)
Internet Protocol Version 4, Src: 69.171.229.16, Dst: 10.0.2.2
Transmission Control Protocol, Src Port: 80, Dst Port: 50840, Seq: 8096, Ack: 1801, Len: 5

No.     Time           Source                Destination           Protocol Length Info
     49 0.683537       69.171.229.16         10.0.2.2              TCP      1514   80 → 50840 [ACK] Seq=8101 Ack=1801 Win=18432 Len=1448 TSval=2197845266 TSecr=900594631 [TCP segment of a reassembled PDU]

Frame 49: 1514 bytes on wire (12112 bits), 1514 bytes captured (12112 bits)
Ethernet II, Src: Apple_e5:66:07 (00:26:08:e5:66:07), Dst: Apple_d8:0f:fa (04:0c:ce:d8:0f:fa)
Internet Protocol Version 4, Src: 69.171.229.16, Dst: 10.0.2.2
Transmission Control Protocol, Src Port: 80, Dst Port: 50840, Seq: 8101, Ack: 1801, Len: 1448

No.     Time           Source                Destination           Protocol Length Info
     50 0.683592       69.171.229.16         10.0.2.2              TCP      1514   80 → 50840 [ACK] Seq=9549 Ack=1801 Win=18432 Len=1448 TSval=2197845266 TSecr=900594631 [TCP segment of a reassembled PDU]

Frame 50: 1514 bytes on wire (12112 bits), 1514 bytes captured (12112 bits)
Ethernet II, Src: Apple_e5:66:07 (00:26:08:e5:66:07), Dst: Apple_d8:0f:fa (04:0c:ce:d8:0f:fa)
Internet Protocol Version 4, Src: 69.171.229.16, Dst: 10.0.2.2
Transmission Control Protocol, Src Port: 80, Dst Port: 50840, Seq: 9549, Ack: 1801, Len: 1448

No.     Time           Source                Destination           Protocol Length Info
     51 0.683644       69.171.229.16         10.0.2.2              TCP      1514   80 → 50840 [PSH, ACK] Seq=10997 Ack=1801 Win=18432 Len=1448 TSval=2197845266 TSecr=900594631 [TCP segment of a reassembled PDU]

Frame 51: 1514 bytes on wire (12112 bits), 1514 bytes captured (12112 bits)
Ethernet II, Src: Apple_e5:66:07 (00:26:08:e5:66:07), Dst: Apple_d8:0f:fa (04:0c:ce:d8:0f:fa)
Internet Protocol Version 4, Src: 69.171.229.16, Dst: 10.0.2.2
Transmission Control Protocol, Src Port: 80, Dst Port: 50840, Seq: 10997, Ack: 1801, Len: 1448

No.     Time           Source                Destination           Protocol Length Info
     52 0.683692       69.171.229.16         10.0.2.2              TCP      1514   80 → 50840 [ACK] Seq=12445 Ack=1801 Win=18432 Len=1448 TSval=2197845266 TSecr=900594631 [TCP segment of a reassembled PDU]

Frame 52: 1514 bytes on wire (12112 bits), 1514 bytes captured (12112 bits)
Ethernet II, Src: Apple_e5:66:07 (00:26:08:e5:66:07), Dst: Apple_d8:0f:fa (04:0c:ce:d8:0f:fa)
Internet Protocol Version 4, Src: 69.171.229.16, Dst: 10.0.2.2
Transmission Control Protocol, Src Port: 80, Dst Port: 50840, Seq: 12445, Ack: 1801, Len: 1448

No.     Time           Source                Destination           Protocol Length Info
     53 0.683741       69.171.229.16         10.0.2.2              TCP      1514   80 → 50840 [ACK] Seq=13893 Ack=1801 Win=18432 Len=1448 TSval=2197845266 TSecr=900594631 [TCP segment of a reassembled PDU]

Frame 53: 1514 bytes on wire (12112 bits), 1514 bytes captured (12112 bits)
Ethernet II, Src: Apple_e5:66:07 (00:26:08:e5:66:07), Dst: Apple_d8:0f:fa (04:0c:ce:d8:0f:fa)
Internet Protocol Version 4, Src: 69.171.229.16, Dst: 10.0.2.2
Transmission Control Protocol, Src Port: 80, Dst Port: 50840, Seq: 13893, Ack: 1801, Len: 1448

No.     Time           Source                Destination           Protocol Length Info
     54 0.683787       69.171.229.16         10.0.2.2              TCP      1514   80 → 50840 [ACK] Seq=15341 Ack=1801 Win=18432 Len=1448 TSval=2197845266 TSecr=900594631 [TCP segment of a reassembled PDU]

Frame 54: 1514 bytes on wire (12112 bits), 1514 bytes captured (12112 bits)
Ethernet II, Src: Apple_e5:66:07 (00:26:08:e5:66:07), Dst: Apple_d8:0f:fa (04:0c:ce:d8:0f:fa)
Internet Protocol Version 4, Src: 69.171.229.16, Dst: 10.0.2.2
Transmission Control Protocol, Src Port: 80, Dst Port: 50840, Seq: 15341, Ack: 1801, Len: 1448

No.     Time           Source                Destination           Protocol Length Info
     55 0.683845       69.171.229.16         10.0.2.2              HTTP     1384   HTTP/1.1 200 OK  (text/html)

Frame 55: 1384 bytes on wire (11072 bits), 1384 bytes captured (11072 bits)
Ethernet II, Src: Apple_e5:66:07 (00:26:08:e5:66:07), Dst: Apple_d8:0f:fa (04:0c:ce:d8:0f:fa)
Internet Protocol Version 4, Src: 69.171.229.16, Dst: 10.0.2.2
Transmission Control Protocol, Src Port: 80, Dst Port: 50840, Seq: 16789, Ack: 1801, Len: 1318
[10 Reassembled TCP Segments (12907 bytes): #46(1448), #47(1448), #48(5), #49(1448), #50(1448), #51(1448), #52(1448), #53(1448), #54(1448), #55(1318)]
Hypertext Transfer Protocol
Line-based text data: text/html

No.     Time           Source                Destination           Protocol Length Info
     56 0.687627       10.0.2.2              69.171.229.16         TCP      66     50840 → 80 [ACK] Seq=1801 Ack=8096 Win=129616 Len=0 TSval=900594751 TSecr=2197845266

Frame 56: 66 bytes on wire (528 bits), 66 bytes captured (528 bits)
Ethernet II, Src: Apple_d8:0f:fa (04:0c:ce:d8:0f:fa), Dst: Apple_e5:66:07 (00:26:08:e5:66:07)
Internet Protocol Version 4, Src: 10.0.2.2, Dst: 69.171.229.16
Transmission Control Protocol, Src Port: 50840, Dst Port: 80, Seq: 1801, Ack: 8096, Len: 0

No.     Time           Source                Destination           Protocol Length Info
     57 0.688056       10.0.2.2              69.171.229.16         TCP      66     50840 → 80 [ACK] Seq=1801 Ack=8101 Win=129616 Len=0 TSval=900594751 TSecr=2197845266

Frame 57: 66 bytes on wire (528 bits), 66 bytes captured (528 bits)
Ethernet II, Src: Apple_d8:0f:fa (04:0c:ce:d8:0f:fa), Dst: Apple_e5:66:07 (00:26:08:e5:66:07)
Internet Protocol Version 4, Src: 10.0.2.2, Dst: 69.171.229.16
Transmission Control Protocol, Src Port: 50840, Dst Port: 80, Seq: 1801, Ack: 8101, Len: 0

No.     Time           Source                Destination           Protocol Length Info
     58 0.688066       10.0.2.2              69.171.229.16         TCP      66     50840 → 80 [ACK] Seq=1801 Ack=10997 Win=128176 Len=0 TSval=900594751 TSecr=2197845266

Frame 58: 66 bytes on wire (528 bits), 66 bytes captured (528 bits)
Ethernet II, Src: Apple_d8:0f:fa (04:0c:ce:d8:0f:fa), Dst: Apple_e5:66:07 (00:26:08:e5:66:07)
Internet Protocol Version 4, Src: 10.0.2.2, Dst: 69.171.229.16
Transmission Control Protocol, Src Port: 50840, Dst Port: 80, Seq: 1801, Ack: 10997, Len: 0

No.     Time           Source                Destination           Protocol Length Info
     59 0.688069       10.0.2.2              69.171.229.16         TCP      66     50840 → 80 [ACK] Seq=1801 Ack=12445 Win=126720 Len=0 TSval=900594751 TSecr=2197845266

Frame 59: 66 bytes on wire (528 bits), 66 bytes captured (528 bits)
Ethernet II, Src: Apple_d8:0f:fa (04:0c:ce:d8:0f:fa), Dst: Apple_e5:66:07 (00:26:08:e5:66:07)
Internet Protocol Version 4, Src: 10.0.2.2, Dst: 69.171.229.16
Transmission Control Protocol, Src Port: 50840, Dst Port: 80, Seq: 1801, Ack: 12445, Len: 0

No.     Time           Source                Destination           Protocol Length Info
     60 0.688071       10.0.2.2              69.171.229.16         TCP      66     50840 → 80 [ACK] Seq=1801 Ack=15341 Win=123824 Len=0 TSval=900594752 TSecr=2197845266

Frame 60: 66 bytes on wire (528 bits), 66 bytes captured (528 bits)
Ethernet II, Src: Apple_d8:0f:fa (04:0c:ce:d8:0f:fa), Dst: Apple_e5:66:07 (00:26:08:e5:66:07)
Internet Protocol Version 4, Src: 10.0.2.2, Dst: 69.171.229.16
Transmission Control Protocol, Src Port: 50840, Dst Port: 80, Seq: 1801, Ack: 15341, Len: 0

No.     Time           Source                Destination           Protocol Length Info
     61 0.688073       10.0.2.2              69.171.229.16         TCP      66     50840 → 80 [ACK] Seq=1801 Ack=16789 Win=131072 Len=0 TSval=900594752 TSecr=2197845266

Frame 61: 66 bytes on wire (528 bits), 66 bytes captured (528 bits)
Ethernet II, Src: Apple_d8:0f:fa (04:0c:ce:d8:0f:fa), Dst: Apple_e5:66:07 (00:26:08:e5:66:07)
Internet Protocol Version 4, Src: 10.0.2.2, Dst: 69.171.229.16
Transmission Control Protocol, Src Port: 50840, Dst Port: 80, Seq: 1801, Ack: 16789, Len: 0

No.     Time           Source                Destination           Protocol Length Info
     62 0.688076       10.0.2.2              69.171.229.16         TCP      66     50840 → 80 [ACK] Seq=1801 Ack=18107 Win=129744 Len=0 TSval=900594752 TSecr=2197845266

Frame 62: 66 bytes on wire (528 bits), 66 bytes captured (528 bits)
Ethernet II, Src: Apple_d8:0f:fa (04:0c:ce:d8:0f:fa), Dst: Apple_e5:66:07 (00:26:08:e5:66:07)
Internet Protocol Version 4, Src: 10.0.2.2, Dst: 69.171.229.16
Transmission Control Protocol, Src Port: 50840, Dst Port: 80, Seq: 1801, Ack: 18107, Len: 0

No.     Time           Source                Destination           Protocol Length Info
     63 1.803803       10.0.2.3              69.171.229.16         TCP      66     55578 → 80 [SYN] Seq=0 Win=8192 Len=0 MSS=1460 WS=256 SACK_PERM=1

Frame 63: 66 bytes on wire (528 bits), 66 bytes captured (528 bits)
Ethernet II, Src: IntelCor_50:f0:a6 (8c:a9:82:50:f0:a6), Dst: Apple_e5:66:07 (00:26:08:e5:66:07)
Internet Protocol Version 4, Src: 10.0.2.3, Dst: 69.171.229.16
Transmission Control Protocol, Src Port: 55578, Dst Port: 80, Seq: 0, Len: 0

No.     Time           Source                Destination           Protocol Length Info
     64 1.869945       69.171.229.16         10.0.2.3              TCP      66     80 → 55578 [SYN, ACK] Seq=0 Ack=1 Win=14600 Len=0 MSS=1460 SACK_PERM=1 WS=512

Frame 64: 66 bytes on wire (528 bits), 66 bytes captured (528 bits)
Ethernet II, Src: Apple_e5:66:07 (00:26:08:e5:66:07), Dst: IntelCor_50:f0:a6 (8c:a9:82:50:f0:a6)
Internet Protocol Version 4, Src: 69.171.229.16, Dst: 10.0.2.3
Transmission Control Protocol, Src Port: 80, Dst Port: 55578, Seq: 0, Ack: 1, Len: 0

